{
  "proof_id": "da5d529bc7afe18508cdb4c2398cc483de07a8df634c1fe175b90d95b69d3974",
  "claim_id": "CPL-GENOME-001",
  "statement": "VAIXLNS Golden Source files are present and content-addressed",
  "subject": "project.genome",
  "epistemic_state": "VERIFIED",
  "evidence": [
    {
      "kind": "file_sha256",
      "ref": "project.genome",
      "digest": "97c55c360037e78dfc2194b90ec9cf5cd7d775d967e5b1d4230adff8dd7cfe08"
    },
    {
      "kind": "file_sha256",
      "ref": "registry/omega/omega-000-master-index.json",
      "digest": "4410a5bbf43f322a6733977e89d2a55a9153580b32863d2cce1ea8f43cc0a8d3"
    }
  ],
  "verification": {
    "method": "scripts/proof_verifier.py",
    "result": "PASS",
    "reproduction_command": "python scripts/proof_verifier.py registry/evidence/control-plane-proof.json"
  },
  "authority": "Ω0_GENESIS_CORE"
}
